{
  "schema_version": "1.0.0",
  "kind": "list-query",
  "feature": {
    "id": "cmz-client-landing-home",
    "name": "CMZ Client — Landing home blocks",
    "description": "Blocs de contenu éditorial actifs affichés sur la page d'accueil publique du client CMZ."
  },
  "operations": [
    {
      "id": "list-home-block-infos",
      "description": "Récupère les blocs de contenu actifs pour la page d'accueil.",
      "item": {
        "id": "home-block-info",
        "description": "Un bloc de contenu éditorial de la page d'accueil.",
        "fields": [
          {
            "name": "id",
            "type": {
              "kind": "primitive",
              "name": "integer",
              "nullable": false
            },
            "required": true
          },
          {
            "name": "title",
            "type": {
              "kind": "primitive",
              "name": "string",
              "nullable": false
            },
            "required": true
          },
          {
            "name": "slug",
            "type": {
              "kind": "primitive",
              "name": "string",
              "nullable": false
            },
            "required": true
          },
          {
            "name": "resume",
            "type": { "kind": "primitive", "name": "string", "nullable": true },
            "required": true
          },
          {
            "name": "content",
            "type": {
              "kind": "primitive",
              "name": "string",
              "nullable": false
            },
            "required": true
          },
          {
            "name": "type",
            "type": {
              "kind": "primitive",
              "name": "string",
              "nullable": false
            },
            "required": true
          },
          {
            "name": "image_url",
            "type": { "kind": "primitive", "name": "string", "nullable": true },
            "required": true
          },
          {
            "name": "video_url",
            "type": { "kind": "primitive", "name": "string", "nullable": true },
            "required": true
          },
          {
            "name": "button_label",
            "type": { "kind": "primitive", "name": "string", "nullable": true },
            "required": true
          },
          {
            "name": "button_url",
            "type": { "kind": "primitive", "name": "string", "nullable": true },
            "required": true
          },
          {
            "name": "updated_at",
            "type": {
              "kind": "primitive",
              "name": "string",
              "nullable": false
            },
            "required": true
          }
        ]
      },
      "access": { "mode": "public" },
      "http": {
        "method": "GET",
        "path": "cms/home-block-infos/actives/pwa",
        "authentication": "none",
        "response_envelope": "simple"
      }
    }
  ]
}
